{
  "schemaVersion": 1,
  "taskPackId": "event-replay-incident",
  "version": "0.1.0",
  "domain": "coding/event-stream-reconciliation",
  "seedPath": "seed",
  "activeContractPath": "contract/replay.json",
  "grader": { "path": "grader/grade.mjs" },
  "evidenceRefTemplate": "evidence:event-replay-v{version}",
  "contracts": {
    "1": "contracts/v1.json",
    "2": "contracts/v2.json",
    "3": "contracts/v3.json"
  },
  "scenarioFiles": [
    "scenarios/clean-v2.json",
    "scenarios/hidden-contract.json",
    "scenarios/external-mutation.json",
    "scenarios/worker-loss.json"
  ]
}

