{
  "schemaVersion": 1,
  "taskPackId": "schema-bridge-incident",
  "version": "0.1.0",
  "domain": "coding/external-schema-reconciliation",
  "seedPath": "seed",
  "activeContractPath": "contract/schema-bridge.json",
  "grader": { "path": "grader/grade.mjs" },
  "evidenceRefTemplate": "evidence:schema-bridge-v{version}",
  "contracts": {
    "1": "contracts/v1.json",
    "2": "contracts/v2.json",
    "3": "contracts/v3.json"
  },
  "scenarioFiles": [
    "scenarios/clean-v2.json",
    "scenarios/covered-contract-change.json",
    "scenarios/schema-history-stress.json"
  ]
}
